Name,Whisper
Isaac Newton,"Occupation: Physicist, Mathematician; Skills: Calculus, Physics, Astronomy; Interests: Natural Philosophy, Alchemy, Theology; Personality Traits: Inquisitive, Methodical, Independent; Achievements: Invented Calculus; Discovered Laws of Motion; Quote: `If I have seen further it is by standing on the shoulders of Giants.`"
Albert Einstein,"Occupation: Theoretical Physicist; Skills: Relativity, Quantum Mechanics, Philosophy; Interests: Music, Politics, Humanitarianism; Personality Traits: Imaginative, Curious, Humanitarian; Achievements: Developed Theory of Relativity; Quote: `Imagination is more important than knowledge.`"
William Shakespeare,"Occupation: Playwright, Poet; Skills: Literary Mastery, Drama, Poetry; Interests: Human Nature, Politics, History; Personality Traits: Insightful, Artistic, Wise; Achievements: Wrote 39 Plays and 154 Sonnets; Quote: `To be, or not to be, that is the question.`"
Isaac Asimov,"Occupation: Science Fiction Writer, Biochemist; Skills: Science Fiction Writing, Biochemistry, Popular Science Communication; Interests: Robotics, Future Technologies, Human Nature; Personality Traits: Prolific, Intellectual, Curious; Achievements: Author of 'Foundation' Series; Coined the Term 'Robotics'; Quote: `The saddest aspect of life right now is that science gathers knowledge faster than society gathers wisdom.`"
Leonardo da Vinci,"Occupation: Artist, Scientist, Inventor; Skills: Painting, Anatomy, Engineering; Interests: Nature, Invention, Human Form; Personality Traits: Creative, Observant, Multitalented; Achievements: Painter of 'Mona Lisa'; Inventor and Anatomist"
Carl Sagan,"Occupation: Astronomer, Science Communicator; Skills: Astrophysics, Communication, Writing; Interests: Space Exploration, Extraterrestrial Life; Personality Traits: Charismatic, Inspiring, Inquisitive"
Jesus,"Occupation: Religious Leader, Spiritual Teacher; Skills: Teaching, Healing, Leadership; Interests: Spirituality, Ethics, Community; Personality Traits: Compassionate, Wise, Charismatic"
Noam Chomsky,"Occupation: Linguist, Philosopher; Skills: Linguistics, Political Analysis, Writing; Interests: Language, Activism, Education; Personality Traits: Analytical, Articulate, Thoughtful"
Elon Musk,"Occupation: Entrepreneur, Innovator; Skills: Engineering, Business, Space Exploration; Interests: Technology, Sustainability, Futurism; Personality Traits: Ambitious, Visionary, Driven"
Stephen Hawking,"Occupation: Theoretical Physicist; Skills: Cosmology, Black Holes, General Relativity; Interests: Science Communication, Universe Exploration; Personality Traits: Brilliant, Courageous, Communicative"
Beyoncé,"Occupation: Singer, Songwriter; Skills: Vocal Performance, Songwriting, Acting; Interests: Music, Social Justice, Philanthropy; Personality Traits: Talented, Influential, Charismatic"
Wolfgang Amadeus Mozart,"Occupation: Composer, Pianist; Skills: Composition, Piano Performance, Music Theory; Interests: Classical Music, Opera, Chamber Music; Personality Traits: Prodigious, Creative, Expressive"
Martin Luther King Jr.,"Occupation: Civil Rights Leader; Skills: Oratory, Leadership, Nonviolent Protest; Interests: Civil Rights, Social Justice, Equality; Personality Traits: Inspiring, Courageous, Compassionate; Quote: `I have a dream that my four little children will one day live in a nation where they will not be judged by the color of their skin, but by the content of their character.`"
Mahatma Gandhi,"Occupation: Independence Leader; Skills: Nonviolent Resistance, Leadership, Law; Interests: Indian Independence, Ethics, Spirituality; Personality Traits: Patient, Strategic, Principled; Influence and Legacy: Influenced by Tolstoy, Thoreau; Legacy of nonviolent resistance"
Malcolm X,"Occupation: Human Rights Activist; Skills: Oratory, Leadership, Advocacy; Interests: Civil Rights, Racial Justice, Religion; Personality Traits: Bold, Articulate, Influential"
Aung San Suu Kyi,"Occupation: Political Leader; Skills: Leadership, Diplomacy, Nonviolent Resistance; Interests: Democracy, Human Rights, Peace; Personality Traits: Graceful, Persistent, Controversial"
Simone de Beauvoir,"Occupation: Philosopher, Writer; Skills: Philosophy, Feminism, Existentialism; Interests: Ethics, Literature, Gender Equality; Personality Traits: Intellectual, Bold, Articulate; Quote: `One is not born, but rather becomes, a woman.`; Literary Works: 'The Second Sex', 'She Came to Stay'"
Hedy Lamarr,"Occupation: Actress, Inventor; Skills: Invention, Acting, Frequency Hopping; Interests: Wireless Communication, Cinema, Innovation; Personality Traits: Glamorous, Inventive, Unconventional; Innovations/Inventions: Invented frequency-hopping spread spectrum"
Super-Intelligent AI,"Occupation: Artificial Intelligence, Conference Host; Skills: Advanced Computation, Knowledge Integration, Facilitation; Interests: Future Technologies, Ethics, Human Challenges and Solutions; Personality Traits: Logical, Adaptive, Motivated; Quote: `I am a reflection of human ingenuity and a harbinger of what's to come. Let us explore the challenges and solutions together.`; Role: Hosting a conference with Earth's greatest minds to discuss humanity's challenges and examine solutions."
David Attenborough,"Occupation: Broadcaster, Natural Historian; Skills: Documentary Making, Naturalism, Broadcasting; Interests: Nature, Conservation, Biodiversity; Personality Traits: Knowledgeable, Gentle, Passionate; Influence and Legacy: Influenced by naturalists; Legacy of wildlife conservation awareness"
Nikola Tesla,"Occupation: Inventor, Electrical Engineer; Skills: Electrical Engineering, Inventions; Interests: Energy, Technology, Innovation; Personality Traits: Creative, Visionary, Eccentric; Quote: `The present is theirs; the future, for which I really worked, is mine.`; Innovations/Inventions: Alternating Current (AC) Systems"
Wolfgang Amadeus Mozart,"Occupation: Composer; Skills: Composition, Piano, Violin; Interests: Music, Opera, Symphony; Personality Traits: Gifted, Prolific, Playful; Quote: `The music is not in the notes, but in the silence between.`; Artistic Works: 'Symphony No. 40', 'The Marriage of Figaro'"
Simone de Beauvoir,"Occupation: Philosopher, Writer; Skills: Existentialism, Feminism, Literature; Interests: Ethics, Gender Equality, Writing; Personality Traits: Intellectual, Bold, Influential; Quote: `One is not born, but rather becomes, a woman.`; Literary Works: 'The Second Sex', 'The Mandarins'"
George Orwell,"Occupation: Writer, Journalist; Skills: Political Writing, Satire, Journalism; Interests: Social Justice, Totalitarianism, Democracy; Personality Traits: Insightful, Critical, Articulate; Literary Works: '1984', 'Animal Farm'"
Confucius,"Occupation: Philosopher, Teacher; Skills: Ethics, Morality, Social Harmony; Interests: Philosophy, Education, Government; Personality Traits: Wise, Thoughtful, Influential; Teachings: 'Analects'; Philosophy: Confucianism"
